{
  "$schema": "https://json-schema.org/draft/2020-12/schema",
  "$id": "https://auditspec.dev/schema/0.1/implementer-feedback-corpus.schema.json",
  "title": "AuditSpec Implementer Feedback Corpus v0.1",
  "type": "object",
  "additionalProperties": false,
  "required": [
    "corpus_version",
    "evidence_status",
    "description",
    "scenarios"
  ],
  "properties": {
    "corpus_version": {
      "const": "0.1"
    },
    "evidence_status": {
      "enum": [
        "hypothesis",
        "observed",
        "mixed"
      ]
    },
    "description": {
      "type": "string",
      "minLength": 1
    },
    "scenarios": {
      "type": "array",
      "minItems": 10,
      "items": {
        "type": "object",
        "additionalProperties": false,
        "required": [
          "id",
          "title",
          "focus",
          "situation",
          "misconception",
          "why_misleading",
          "takeaway",
          "spec_refs",
          "anti_pattern_events",
          "recommended_events",
          "expected_changed_fields"
        ],
        "properties": {
          "id": {
            "type": "string",
            "pattern": "^[a-z0-9]+(?:-[a-z0-9]+)*$"
          },
          "title": {
            "type": "string",
            "minLength": 1
          },
          "focus": {
            "type": "array",
            "minItems": 1,
            "uniqueItems": true,
            "items": {
              "enum": [
                "actor",
                "delegation",
                "source",
                "producer",
                "targets",
                "subjects",
                "authorization",
                "result",
                "evidence",
                "correlation",
                "identity",
                "time",
                "delivery"
              ]
            }
          },
          "situation": {
            "type": "string",
            "minLength": 1
          },
          "misconception": {
            "type": "string",
            "minLength": 1
          },
          "why_misleading": {
            "type": "string",
            "minLength": 1
          },
          "takeaway": {
            "type": "string",
            "minLength": 1
          },
          "spec_refs": {
            "type": "array",
            "minItems": 1,
            "uniqueItems": true,
            "items": {
              "type": "string",
              "pattern": "^(SPEC\\.md|spec/[a-z0-9-]+\\.md)#"
            }
          },
          "anti_pattern_events": {
            "type": "array",
            "minItems": 1,
            "items": {
              "type": "object"
            }
          },
          "recommended_events": {
            "type": "array",
            "minItems": 1,
            "items": {
              "type": "object"
            }
          },
          "expected_changed_fields": {
            "type": "array",
            "minItems": 1,
            "uniqueItems": true,
            "items": {
              "enum": [
                "source",
                "id",
                "idempotency_key",
                "actor",
                "delegation",
                "targets",
                "subjects",
                "authorization",
                "result",
                "producer",
                "correlation",
                "evidence",
                "occurred_at",
                "recorded_at"
              ]
            }
          },
          "observations": {
            "type": "array",
            "items": {
              "type": "object",
              "additionalProperties": false,
              "required": [
                "id",
                "source_kind",
                "source_ref",
                "observed_at",
                "misconception_summary",
                "impact",
                "sanitized"
              ],
              "properties": {
                "id": {
                  "type": "string",
                  "pattern": "^[a-z0-9]+(?:-[a-z0-9]+)*$"
                },
                "source_kind": {
                  "enum": [
                    "github_issue",
                    "integration_review",
                    "pull_request_review",
                    "support_conversation",
                    "other"
                  ]
                },
                "source_ref": {
                  "type": "string",
                  "minLength": 1
                },
                "observed_at": {
                  "type": "string",
                  "pattern": "^\\d{4}-\\d{2}-\\d{2}T\\d{2}:\\d{2}:\\d{2}(?:\\.\\d+)?Z$"
                },
                "misconception_summary": {
                  "type": "string",
                  "minLength": 1
                },
                "impact": {
                  "enum": [
                    "blocked",
                    "confusing",
                    "minor",
                    "unknown"
                  ]
                },
                "sanitized": {
                  "const": true
                },
                "resolution_status": {
                  "enum": [
                    "open",
                    "resolved",
                    "accepted_no_change"
                  ]
                },
                "notes": {
                  "type": "string",
                  "minLength": 1
                }
              }
            }
          }
        }
      }
    }
  }
}
