{
  "corpus_version": "0.1",
  "evidence_status": "hypothesis",
  "description": "Hypothesized first-time implementer confusion cases. Every anti-pattern is intentionally Core-schema-valid so the corpus tests semantic understanding rather than only JSON shape.",
  "scenarios": [
    {
      "id": "agent-on-behalf-of-user",
      "title": "Keep the AI agent as the immediate actor",
      "focus": [
        "actor",
        "delegation"
      ],
      "situation": "Agent agent:7 executes invoice.pay after user 42 asks it to perform the payment.",
      "misconception": "Record the user as actor because the business intent originated with the user.",
      "why_misleading": "It erases the entity that directly caused the audited operation and collapses delegation into identity.",
      "takeaway": "actor is the immediate actor; the represented user belongs in the ordered delegation chain.",
      "spec_refs": [
        "SPEC.md#4-actor",
        "SPEC.md#5-delegation-and-impersonation"
      ],
      "anti_pattern_events": [
        {
          "spec_version": "0.1",
          "id": "aud_feedback_agent_on_behalf_of_user",
          "source": "urn:example:billing",
          "actor": {
            "type": "user",
            "id": "42"
          },
          "action": "invoice.pay",
          "result": {
            "status": "succeeded"
          },
          "occurred_at": "2026-10-08T09:00:00Z",
          "recorded_at": "2026-10-08T09:00:00.010Z"
        }
      ],
      "recommended_events": [
        {
          "spec_version": "0.1",
          "id": "aud_feedback_agent_on_behalf_of_user",
          "source": "urn:example:billing",
          "actor": {
            "type": "agent",
            "id": "agent:7"
          },
          "action": "invoice.pay",
          "result": {
            "status": "succeeded"
          },
          "occurred_at": "2026-10-08T09:00:00Z",
          "recorded_at": "2026-10-08T09:00:00.010Z",
          "delegation": [
            {
              "relationship": "on_behalf_of",
              "principal": {
                "type": "user",
                "id": "42"
              }
            }
          ]
        }
      ],
      "expected_changed_fields": [
        "actor",
        "delegation"
      ]
    },
    {
      "id": "nested-delegation-order",
      "title": "Order delegation nearest to the actor first",
      "focus": [
        "delegation"
      ],
      "situation": "A child agent acts for a parent agent, which acts on behalf of user 42.",
      "misconception": "List the human principal first because the human is ultimately responsible.",
      "why_misleading": "AuditSpec delegation order is structural, not importance-ranked: the first entry is nearest to the immediate actor.",
      "takeaway": "For child -> parent -> user, the chain must be [parent, user].",
      "spec_refs": [
        "SPEC.md#5-delegation-and-impersonation",
        "spec/actors.md#actors-and-delegation"
      ],
      "anti_pattern_events": [
        {
          "spec_version": "0.1",
          "id": "aud_feedback_nested_delegation_order",
          "source": "urn:example:billing",
          "actor": {
            "type": "agent",
            "id": "agent:child"
          },
          "action": "invoice.pay",
          "result": {
            "status": "succeeded"
          },
          "occurred_at": "2026-10-08T09:00:00Z",
          "recorded_at": "2026-10-08T09:00:00.010Z",
          "delegation": [
            {
              "relationship": "on_behalf_of",
              "principal": {
                "type": "user",
                "id": "42"
              }
            },
            {
              "relationship": "delegated_by",
              "principal": {
                "type": "agent",
                "id": "agent:parent"
              }
            }
          ]
        }
      ],
      "recommended_events": [
        {
          "spec_version": "0.1",
          "id": "aud_feedback_nested_delegation_order",
          "source": "urn:example:billing",
          "actor": {
            "type": "agent",
            "id": "agent:child"
          },
          "action": "invoice.pay",
          "result": {
            "status": "succeeded"
          },
          "occurred_at": "2026-10-08T09:00:00Z",
          "recorded_at": "2026-10-08T09:00:00.010Z",
          "delegation": [
            {
              "relationship": "delegated_by",
              "principal": {
                "type": "agent",
                "id": "agent:parent"
              }
            },
            {
              "relationship": "on_behalf_of",
              "principal": {
                "type": "user",
                "id": "42"
              }
            }
          ]
        }
      ],
      "expected_changed_fields": [
        "delegation"
      ]
    },
    {
      "id": "impersonation-keeps-operator",
      "title": "Preserve the operator during impersonation",
      "focus": [
        "actor",
        "delegation"
      ],
      "situation": "Support operator admin:99 impersonates customer user:42 to inspect an account.",
      "misconception": "Record user 42 as actor because the application session is impersonating that user.",
      "why_misleading": "It hides who actually operated the session and destroys accountability for the impersonation action.",
      "takeaway": "Keep the operator as actor and record the impersonated principal in delegation with a safe reason/reference.",
      "spec_refs": [
        "SPEC.md#5-delegation-and-impersonation",
        "spec/actors.md#actors-and-delegation"
      ],
      "anti_pattern_events": [
        {
          "spec_version": "0.1",
          "id": "aud_feedback_impersonation_keeps_operator",
          "source": "urn:example:billing",
          "actor": {
            "type": "user",
            "id": "42"
          },
          "action": "account.view",
          "result": {
            "status": "succeeded"
          },
          "occurred_at": "2026-10-08T09:00:00Z",
          "recorded_at": "2026-10-08T09:00:00.010Z"
        }
      ],
      "recommended_events": [
        {
          "spec_version": "0.1",
          "id": "aud_feedback_impersonation_keeps_operator",
          "source": "urn:example:billing",
          "actor": {
            "type": "user",
            "id": "admin:99"
          },
          "action": "account.view",
          "result": {
            "status": "succeeded"
          },
          "occurred_at": "2026-10-08T09:00:00Z",
          "recorded_at": "2026-10-08T09:00:00.010Z",
          "delegation": [
            {
              "relationship": "impersonation",
              "principal": {
                "type": "user",
                "id": "42"
              },
              "reason": "support_case",
              "reference": "SUP-1842"
            }
          ]
        }
      ],
      "expected_changed_fields": [
        "actor",
        "delegation"
      ]
    },
    {
      "id": "source-is-not-producer-version",
      "title": "Keep source stable across producer deployments",
      "focus": [
        "source",
        "producer",
        "identity"
      ],
      "situation": "billing-worker version 17 emits an audit event for the billing bounded context.",
      "misconception": "Put the deployable component and its version into source.",
      "why_misleading": "Changing source changes the logical event identity namespace because identity is (source, id).",
      "takeaway": "Use a stable bounded-context/system source and record software component/version under producer.",
      "spec_refs": [
        "SPEC.md#3-event-identity-and-source",
        "SPEC.md#12-producer-and-origin",
        "spec/delivery.md#logical-event-identity"
      ],
      "anti_pattern_events": [
        {
          "spec_version": "0.1",
          "id": "aud_feedback_source_is_not_producer_version",
          "source": "urn:example:billing-worker:v17",
          "actor": {
            "type": "user",
            "id": "42"
          },
          "action": "invoice.pay",
          "result": {
            "status": "succeeded"
          },
          "occurred_at": "2026-10-08T09:00:00Z",
          "recorded_at": "2026-10-08T09:00:00.010Z",
          "producer": {
            "name": "billing-worker-v17"
          }
        }
      ],
      "recommended_events": [
        {
          "spec_version": "0.1",
          "id": "aud_feedback_source_is_not_producer_version",
          "source": "urn:example:billing",
          "actor": {
            "type": "user",
            "id": "42"
          },
          "action": "invoice.pay",
          "result": {
            "status": "succeeded"
          },
          "occurred_at": "2026-10-08T09:00:00Z",
          "recorded_at": "2026-10-08T09:00:00.010Z",
          "producer": {
            "name": "billing-worker",
            "version": "17"
          }
        }
      ],
      "expected_changed_fields": [
        "source",
        "producer"
      ]
    },
    {
      "id": "target-versus-subject",
      "title": "Separate the resource acted on from the entity affected",
      "focus": [
        "targets",
        "subjects"
      ],
      "situation": "An invoice refund directly mutates invoice INV-42 and materially affects customer user:42.",
      "misconception": "Put every related entity into targets.",
      "why_misleading": "It makes consumers unable to distinguish the directly acted-on resource from materially affected entities.",
      "takeaway": "Use targets for resources directly acted upon and subjects for materially affected entities.",
      "spec_refs": [
        "SPEC.md#7-targets-and-subjects"
      ],
      "anti_pattern_events": [
        {
          "spec_version": "0.1",
          "id": "aud_feedback_target_versus_subject",
          "source": "urn:example:billing",
          "actor": {
            "type": "user",
            "id": "42"
          },